{
  "schema_version": 1,
  "brand": {
    "name": "Townlight",
    "organization": "townlight",
    "umbrella_repository": "townlight/townlight",
    "domains": ["townlight.org", "townlight.io", "townlight.net"],
    "legacy_organizations": ["CivicSuite"]
  },
  "desktop_release": {
    "version": "1.0.4",
    "tag": "civicsuite-windows-local-v1.0.4",
    "commit": "e596da3a81b3f4f35ea9a9019221cc0e62b7124b",
    "channel": "public-beta",
    "published_at": "2026-07-13",
    "asset_policy": "windows-msi"
  },
  "asset_policies": {
    "windows-msi": ["msi", "evidence"],
    "python-attested": ["wheel", "sdist", "checksums"],
    "python-package": ["wheel", "sdist", "checksums"],
    "spec-only": []
  },
  "products": {
    "records": {
      "public_name": "Townlight Records",
      "status": "stabilizing",
      "modules": ["core", "records", "notice", "access"],
      "public_website_status": "deferred-until-public-beta-ready"
    }
  },
  "profiles": {
    "minimal": {"modules": ["core"], "disabled": false},
    "clerk-core": {"modules": ["core", "records", "meetings"], "disabled": false},
    "records-beta": {"modules": ["core", "records", "notice", "access"], "disabled": false},
    "city-core": {"modules": ["core", "records", "meetings", "code", "notice", "access"], "disabled": false},
    "land-use": {"modules": ["core", "code", "zoning", "planning", "permitting", "inspections"], "disabled": true},
    "full-suite": {
      "modules": ["core", "records", "meetings", "code", "zoning", "access", "planning", "permitting", "inspections", "grants", "procurement", "contracts", "boards", "notice", "311", "communications", "data", "regulatory-watch", "api", "hr", "budget", "legal", "elections", "utilities", "courts", "safety", "library", "parks"],
      "disabled": true
    },
    "custom": {"modules": [], "disabled": false}
  },
  "module_order": ["core", "records", "meetings", "code", "access", "zoning", "planning", "permitting", "inspections", "grants", "procurement", "contracts", "boards", "notice", "311", "communications", "data", "regulatory-watch", "api", "hr", "budget", "legal", "elections", "utilities", "courts", "safety", "library", "parks"],
  "modules": {
    "core": {
      "public_name": "Townlight Core", "public_slug": "core",
      "legacy": {"technical_id": "civiccore", "product_names": ["CivicCore"], "package_names": ["civiccore"]},
      "repository": {"name": "townlight/core", "aliases": ["CivicSuite/civiccore"], "default_branch": "main", "manifest_path": "pyproject.toml"},
      "versions": {"development": "1.2.1", "released": "1.2.1", "installer": "1.2.1", "public_status": "1.2.1"},
      "release": {"tag": "v1.2.1", "published_at": "2026-07-04", "asset_policy": "python-attested"},
      "compatibility": {"development_core": null, "installer_core": null, "public_status_core": null},
      "dependencies": [],
      "maturity": {"state": "platform", "availability": "runtime", "arch_tier": 0, "legacy_grade": "platform", "public_status_released_at": "2026-07-04"},
      "installer": {"tier": 0, "role": "shared platform", "status": "v1_2_1_records_beta_platform", "source_commit": "b4d0156bdc6883c1c3ef167abe0379f9ca32b258"}
    },
    "records": {
      "public_name": "Townlight Records", "public_slug": "records",
      "legacy": {"technical_id": "civicrecords-ai", "product_names": ["CivicRecords AI", "CivicSunshine"], "package_names": ["civicrecords-ai"]},
      "repository": {"name": "townlight/sunshine", "aliases": ["CivicSuite/civicrecords-ai", "CivicSuite/civicsunshine"], "default_branch": "master", "manifest_path": "backend/pyproject.toml"},
      "versions": {"development": "1.7.3", "released": "1.7.3", "installer": "1.7.3", "public_status": "1.7.3"},
      "release": {"tag": "v1.7.3", "published_at": "2026-05-24", "asset_policy": "python-attested"},
      "compatibility": {"development_core": "1.2.0", "installer_core": "1.2.1", "public_status_core": "1.2.1"},
      "dependencies": ["core"],
      "maturity": {"state": "public-beta", "availability": "runtime", "arch_tier": 1, "legacy_grade": "released", "public_status_released_at": "2026-05-24"},
      "installer": {"tier": 1, "role": "records workflow", "status": "v1_7_3_records_beta_candidate", "source_commit": "edf1c8d8078c85baff691030a599b8eef670bca6"}
    },
    "meetings": {
      "public_name": "Townlight Meetings", "public_slug": "meetings",
      "legacy": {"technical_id": "civicclerk", "product_names": ["CivicClerk", "CivicMeetings"], "package_names": ["civicclerk"]},
      "repository": {"name": "townlight/meetings", "aliases": ["CivicSuite/civicclerk", "CivicSuite/civicmeetings"], "default_branch": "main", "manifest_path": "pyproject.toml"},
      "versions": {"development": "1.0.4", "released": "1.0.4", "installer": "1.0.4", "public_status": "1.0.4"},
      "release": {"tag": "v1.0.4", "published_at": "2026-06-13", "asset_policy": "python-attested"},
      "compatibility": {"development_core": "1.2.1", "installer_core": "1.2.0", "public_status_core": "1.2.0"},
      "dependencies": ["core"],
      "maturity": {"state": "public-beta", "availability": "runtime", "arch_tier": 1, "legacy_grade": "released", "public_status_released_at": "2026-06-13"},
      "installer": {"tier": 1, "role": "meetings workflow", "status": "v1_0_4_city_core_release_car", "source_commit": "fa1874edfe977bfc36ddea2939df6464b5bc16be"}
    },
    "code": {
      "public_name": "Townlight Code", "public_slug": "code",
      "legacy": {"technical_id": "civiccode", "product_names": ["CivicCode"], "package_names": ["civiccode"]},
      "repository": {"name": "townlight/ordinances", "aliases": ["CivicSuite/civiccode"], "default_branch": "main", "manifest_path": "pyproject.toml"},
      "versions": {"development": "1.0.8", "released": "1.0.8", "installer": "1.0.8", "public_status": "1.0.8"},
      "release": {"tag": "v1.0.8", "published_at": "2026-05-23", "asset_policy": "python-attested"},
      "compatibility": {"development_core": "1.2.1", "installer_core": "1.2.0", "public_status_core": "1.2.0"},
      "dependencies": ["core", "meetings"],
      "maturity": {"state": "public-beta", "availability": "runtime", "arch_tier": 1, "legacy_grade": "released", "public_status_released_at": "2026-05-23"},
      "installer": {"tier": 1, "role": "municipal code", "status": "v1_0_8_city_core_release_car", "source_commit": "a960bba0a2249d118b593dd61bee3a65a69a9d77"}
    },
    "access": {
      "public_name": "Townlight Access", "public_slug": "access",
      "legacy": {"technical_id": "civicaccess", "product_names": ["CivicAccess"], "package_names": ["civicaccess"]},
      "repository": {"name": "townlight/access", "aliases": ["CivicSuite/civicaccess"], "default_branch": "main", "manifest_path": "pyproject.toml"},
      "versions": {"development": "0.4.0", "released": "0.4.0", "installer": "0.4.0", "public_status": "0.4.0"},
      "release": {"tag": "v0.4.0", "published_at": "2026-06-28", "asset_policy": "python-package"},
      "compatibility": {"development_core": "1.2.0", "installer_core": "1.2.1", "public_status_core": "1.2.1"},
      "dependencies": ["core"],
      "maturity": {"state": "public-beta", "availability": "runtime", "arch_tier": 1, "legacy_grade": "released", "public_status_released_at": "2026-06-28"},
      "installer": {"tier": 3, "role": "accessibility + records-ready export", "status": "v0_4_0_records_beta_candidate", "source_commit": "b9100edc80ca496d6061f1cdb3eb39a60ff5f31a"}
    },
    "zoning": {
      "public_name": "Townlight Zoning", "public_slug": "zoning",
      "legacy": {"technical_id": "civiczone", "product_names": ["CivicZone"], "package_names": ["civiczone"]},
      "repository": {"name": "townlight/zone", "aliases": ["CivicSuite/civiczone"], "default_branch": "main", "manifest_path": "pyproject.toml"},
      "versions": {"development": "0.2.2", "released": "0.2.2", "installer": "0.2.2", "public_status": "0.2.2"},
      "release": {"tag": "v0.2.2", "published_at": "2026-05-23", "asset_policy": "python-package"},
      "compatibility": {"development_core": "1.1.0", "installer_core": "1.1.0", "public_status_core": "1.1.0"},
      "dependencies": ["core", "code"],
      "maturity": {"state": "queued", "availability": "runtime", "arch_tier": 2, "legacy_grade": "queued", "public_status_released_at": "2026-05-23"},
      "installer": {"tier": 2, "role": "zoning and land use", "status": "demoted_v0_2_2_truth_repair_no_functional_upgrade", "source_commit": null}
    },
    "planning": {
      "public_name": "Townlight Planning", "public_slug": "planning",
      "legacy": {"technical_id": "civicplan", "product_names": ["CivicPlan"], "package_names": ["civicplan"]},
      "repository": {"name": "townlight/plan", "aliases": ["CivicSuite/civicplan"], "default_branch": "main", "manifest_path": "pyproject.toml"},
      "versions": {"development": "0.2.2", "released": "0.2.2", "installer": "0.2.2", "public_status": "0.2.2"},
      "release": {"tag": "v0.2.2", "published_at": "2026-05-23", "asset_policy": "python-package"},
      "compatibility": {"development_core": "1.1.0", "installer_core": "1.1.0", "public_status_core": "1.1.0"},
      "dependencies": ["core", "zoning", "meetings"],
      "maturity": {"state": "queued", "availability": "runtime", "arch_tier": 2, "legacy_grade": "queued", "public_status_released_at": "2026-05-23"},
      "installer": {"tier": 2, "role": "planning policy lookup", "status": "demoted_v0_2_2_truth_repair_no_functional_upgrade", "source_commit": null}
    },
    "permitting": {
      "public_name": "Townlight Permitting", "public_slug": "permitting",
      "legacy": {"technical_id": "civicpermit", "product_names": ["CivicPermit Assist", "CivicPermit"], "package_names": ["civicpermit"]},
      "repository": {"name": "townlight/permit", "aliases": ["CivicSuite/civicpermit"], "default_branch": "main", "manifest_path": "pyproject.toml"},